id,Case_date,FolkNotes
312,1588,"According to Alison Pierson his father was the king's smith.  He was taken away from his father by one man of Egypt, one gyant, while he was a bairn.  He lived their for 12 years.  His father supposedly died because he opened a 'preist-buik' and looked at it.  Perhaps Pierson was learning from him while she lived with him at the age of 12.  The fairies told Pierson that Sympsoune was one of them.  Pitcairn quotes the 'Legend of the Bischop of St. Androis' for his case.  He told Pierson that he had been carried away (out of middle earth) with the Fairies and that when a whirlwind was heard that was them.  Mention of a tithe to hell."
313,1590,"Katherine Ross, sent Christiane Roiss to him to purchase some elfshot. No details from McNilland."
314,1590,Claimed by others that he was involved in rituals at halloween.
315,1591,Said to have used a cat in rituals.
316,1591,Said to have been involved in using a cat in a ritual.
317,1591,Others said she was involved in rituals with corpse and corpse powder and attended meetings at Halloween.
318,1591,"Sampson said he was involved in rituals using corpse, glass, salt and thread."
319,1591,Sampson said they participated in that throwing of cats into the sea to create wind.
320,1591,Sampson said involved in the throwing of a cat into the sea ritual to raise storms.
321,1591,"Sampson said she was involved in rituals using corpse, glass, salt and thread."
322,1591,Sampson said she was involved in rituals with corpse and corpse powder.
323,1591,"It was claimed by others that she was involved in ritual with corpse and corpse powder, and attended meetings at Halloween."
324,1592,"Also the head of a young calf, newly calfed."
325,1591,Said by Macalzene to have used animal blood for healing.
326,1591,Said by Macalzene to have been involved in a ritual using corpse powder and grave earth.
327,1659,A woman found a lump of flesh in her bed in the shape of a hand and fell ill.  The same woman hired a woman from Dunblane to cure her with a drink.  A man cam to her for advice about the removal of a bewitchment.  She told the man to grip the suspected witch's coat tail and drink ale with her and ask for his health 3 times for God's sake.  She made bad predictions which came true.
328,1697,"Accused of participating in 6 meetings where wax images with pins were used to enact murder and roasting the wax image was also used to kill and torment people.  One meeting to strangle a child took place at midnight in the kid's bedroom.  Apparently physical charmes made of bone, blood, and hair were found"
329,1697,she was named as being part of one of several alleged meetings of witches to use image magic to kill children.
330,1697,Lots of image magic alleged to have been used for child murders.
331,1700,Use of charmes to make a tormented girl's hands swell.
332,1697,Alleged use of image magic and wax images to murder children and adults.  Also to enact possessions.
333,1697,allegedly part of a group that used image magic to kill people including children.
334,1697,alleged use of wax images for image magic to kill people.
335,1697,alleged with a group that used image magic on several occassions.  A man brought her milk after having a fall out followed by threats from her and illnesses.
336,1697,allegedly part of a group that used image magic to kill
337,1697,allegedly participated with a group in the use of image magic to kill people.
338,1697,allegedly part of a group that used image magic to kill.
339,1602,Turning of the sive and the shears.
340,1616,She was seen in a transe repeating words when her husband was at sea and in trouble.
341,1665,Used a wresting thread to cure a wrested cow.  Was paid 40 pennies for a cure.  Made a charm out of something like ground salt put into a cloute and put onto a cow's back.  A blue thread around a man's waist.  Worm grass for curing the worm.  Fasting and meat eating.
342,1640,She supposedly sailed in a cockle shell.
343,1659,she supposedly walked about the town counter-clockwise.
344,1616,cast a suitor's left shoe over the house to determine if one should marry him.  Walked thrise around the church with a bare head and hair flowing.
345,1579,Conversance with the Devil on Pasche.
346,1579,"She did a cure using 'plasteris and bathis of ???, and blak snailles upoun ane pece blak mantillone yairin' to cure a bad leg.  Also used bluid cress [watercress?], and a pece of blak clayt."
347,1658,Healed by wrapping a woman up in a linen cloth and then burning it.  Also used powder
348,1659,McNauth was the object of counter-magic.  Her victim was to seek her health and get three stopings of straw from Janet's lintel and burn them.  She was seen at the ale house with cats and carlings.  Use of a magic charm for protection.
349,1658,20 Days before hallowmas she was at the shore gathering shellfish with Janet Corsan when they got lost and ended up in 'some eldridge place unknowin to hir where she saw a compne of weemen and one cold black uglie greusome man'.
350,1593,she was involved with the picture of wax that Agnes Sampson used.  They melted it
351,1635,She murdered her husband with a drink made of foxtree leaves and tried to give her daughter an abortion (a drink of wine and salt) that backfired when her daughter died.  Her grief and guilt seem to lay behind her confession.  She confessed that the Devil told her how to make both drinks.
352,1635,used foxtree leaves to kill a woman